date,debate,speaker,speaker_id,context,speech_url
1967-02-23,NATIONALITY AND CITIZENSHIP BELL 1967: Second Reading,Mr SNEDDEN,DQF,Clause 4 (a) of the Bill makes similar changes in the conditions for the naturalisation of aliens as are made by clause 3 (b) in respect of the requirements for the grant of citizenship to British subjects and Irish citizens.,https://historichansard.net/hofreps/1967/19670223_reps_26_hor54/#subdebate-20-0
1967-03-07,QUESTION: GOVERNOR-GENERAL'S SPEECH,Mr LEE,L0U,"I know that the honourable member for Maribyrnong  (Mr Stokes)  will agree with me when 1 say that often in recent weeks we have been called to go to naturalisation ceremonies where 70, 100 or 120 people at a time have been naturalised.",https://historichansard.net/hofreps/1967/19670307_reps_26_hor54/#subdebate-34-0
1967-03-07,ANSWERS TO QUESTIONS UPON NOTICE: Naturalisation - (Question No. 27),Mr Webb,KXI,"How many persons who were eligible for naturalisation at 31st December 1966, were unnaturalised?",https://historichansard.net/hofreps/1967/19670307_reps_26_hor54/#subdebate-35-3
1967-03-07,ANSWERS TO QUESTIONS UPON NOTICE: Naturalisation - (Question No. 27),Mr Snedden,DQF,"During the year ended 31st December 1966, 31,135 persons became Australian citizens through the process of naturalisation.",https://historichansard.net/hofreps/1967/19670307_reps_26_hor54/#subdebate-35-3
1967-03-15,QUESTION: NATIONALITY,Mr NIXON,009OD,,https://historichansard.net/hofreps/1967/19670315_reps_26_hor54/#subdebate-14-0
1967-04-04,NATIONALITY AND CITIZENSHIP BILL 1967: Second Reading,Mr BARNARD,JO8,"Such a check is always made in respect of aliens who apply for naturalisation, and also those called up for two years national service training.",https://historichansard.net/hofreps/1967/19670404_reps_26_hor54/#subdebate-24-0
1967-04-04,NATIONALITY AND CITIZENSHIP BILL 1967: Second Reading,Mr McLEAY,KSB,I believe that our migrants themselves have completely disproved the suggestion not only by the continuing flow of migration but also by the continuing rate of naturalisation.,https://historichansard.net/hofreps/1967/19670404_reps_26_hor54/#subdebate-24-0
1967-04-04,NATIONALITY AND CITIZENSHIP BILL 1967: Second Reading,Mr STEWART,KUX,"Group 5, under the Chairmanship of  Dr Una  Porter of the Young Women's Christian Association, also commented on the problem of naturalisation and the call up for national service training of nonBritish subjects.",https://historichansard.net/hofreps/1967/19670404_reps_26_hor54/#subdebate-24-0
1967-04-04,NATIONALITY AND CITIZENSHIP BILL 1967: Second Reading,Mr FOX,JWI,,https://historichansard.net/hofreps/1967/19670404_reps_26_hor54/#subdebate-24-0
1967-04-04,NATIONALITY AND CITIZENSHIP BILL 1967: Second Reading,Mr COLLARD,JZX,It makes no sense to have the qualifying period for naturalisation reduced by three months.,https://historichansard.net/hofreps/1967/19670404_reps_26_hor54/#subdebate-24-0
1967-04-04,NATIONALITY AND CITIZENSHIP BILL 1967: Second Reading,Mr DALY,6V4,"It throws into the arena a matter on which there is a great deal of disagreement, namely a suitable qualifying period for naturalisation.",https://historichansard.net/hofreps/1967/19670404_reps_26_hor54/#subdebate-24-0
1967-04-04,NATIONALITY AND CITIZENSHIP BILL 1967,Dr MACKAY,KIW,,https://historichansard.net/hofreps/1967/19670404_reps_26_hor54/#debate-30
1967-04-04,NATIONALITY AND CITIZENSHIP BILL 1967,Mr SNEDDEN,DQF,If this Bill does not pass it will mean that the national servicemen will not be able to receive his naturalisation after three months of service.,https://historichansard.net/hofreps/1967/19670404_reps_26_hor54/#debate-30
1967-04-12,SOCIAL SERVICES BILL 1967: Second Reading,Mr CONNOR,K0O,We can see the reflection of this situation on the number of naturalisations in my constituency.,https://historichansard.net/hofreps/1967/19670412_reps_26_hor54/#subdebate-20-0
1967-04-12,SOCIAL SERVICES BILL 1967: Second Reading,Mr CONNOR,K0O,"Within my constituency there are some 30,000 migrants but only 6,500 have sought naturalisation.",https://historichansard.net/hofreps/1967/19670412_reps_26_hor54/#subdebate-20-0
1967-05-11,SUPPLY BILL (No. 1) 1967-68: Second Reading,Mr OPPERMAN,KMB,"Perhaps one of the ""most progressive and appreciated steps taken while I held the Immigration portfolio was the relaxation of the naturalisation period for Asians.",https://historichansard.net/hofreps/1967/19670511_reps_26_hor55/#subdebate-26-0
1967-05-18,QUESTION: REFERENDUM,Mr WHITLAM,6U4,,https://historichansard.net/hofreps/1967/19670518_reps_26_hor55/#subdebate-31-0
1967-08-17,NAVIGATION BILL 1967: Second Reading,Mr BENSON,JP5,,https://historichansard.net/hofreps/1967/19670817_reps_26_hor56/#subdebate-22-0
1967-09-19,APPROPRIATION BILL (No. 1),Mr BRYANT,JSU,A number of people I know have had their naturalisation refused because of security reports.,https://historichansard.net/hofreps/1967/19670919_reps_26_hor56/#debate-27
1967-09-20,QUESTION: DEFENCE,Mr FAIRHALL,KEN,,https://historichansard.net/hofreps/1967/19670920_reps_26_hor56/#subdebate-13-0
1967-10-03,REPATRIATION PAYMENTS: Department of Immigration,Mr CLEAVER,JYO,The naturalisation list resently issued shows a rather large number of Chinese people as having received naturalisation.,https://historichansard.net/hofreps/1967/19671003_reps_26_hor57/#subdebate-16-4
1967-10-03,REPATRIATION PAYMENTS: Department of Immigration,Mr DUTHIE,KDA,,https://historichansard.net/hofreps/1967/19671003_reps_26_hor57/#subdebate-16-4
1967-10-03,REPATRIATION PAYMENTS: Department of Immigration,Mr FOX,JWI,"Whenever possible, final naturalisation proceedings were conducted on 'Citizenship Day' in conjunction with the commemorative ceremonies held in local communities.",https://historichansard.net/hofreps/1967/19671003_reps_26_hor57/#subdebate-16-4
1967-10-17,ANSWERS TO QUESTIONS UPON NOTICE: Naturalisation (Question No. 621),Mr Hayden,RK4,"From what countries did these applicants for naturalisation come, and how many rejected applicants came from each of those countries?",https://historichansard.net/hofreps/1967/19671017_reps_26_hor57/#subdebate-33-7
1967-10-24,QUESTION: IMMIGRATION,Mr KILLEN,4U4,,https://historichansard.net/hofreps/1967/19671024_reps_26_hor57/#subdebate-3-0
1967-10-26,GRIEVANCE DEBATE,Dr MACKAY,KIW,"When the Government Members Immigration Committee was told by the Minister for Immigration of the intention to change the form of the naturalisation ceremony and to drop the renunciation of former allegiance, we opposed the proposal and advocated the precise wording of the present oath of allegiance.",https://historichansard.net/hofreps/1967/19671026_reps_26_hor57/#debate-23
1968-05-07,IMMIGRATION: Ministerial Statement,Mr SNEDDEN,DQF,"People who come to Australia as assisted migrants, acquire Australian citizenship by naturalisation or registration, and then depart for permanent residence abroad, will come under the conditions applying to migrants who.",https://historichansard.net/hofreps/1968/19680507_reps_26_hor59/#subdebate-25-0
1968-05-07,IMMIGRATION: Ministerial Statement,Mr Clyde Cameron,2V4,,https://historichansard.net/hofreps/1968/19680507_reps_26_hor59/#subdebate-25-0
1968-05-14,QUESTION: ANTI-WAR DEMONSTRATIONS,Mr BRYANT,JSU,"In recent times I have met, as other honourable members must have met, a number of people who have been refused naturalisation because they are or have been Communists or because it is alleged that they are Communists.",https://historichansard.net/hofreps/1968/19680514_reps_26_hor59/#subdebate-25-0
1968-05-28,ANSWERS TO QUESTIONS UPON NOTICE: Naturalisation Ceremonies (Question No. 221),Mr O'Connor,K58,"Is it a fact that the holding of a naturalisation ceremony imposes, in some instances, a heavy financial burden on the municipality concerned?",https://historichansard.net/hofreps/1968/19680528_reps_26_hor59/#subdebate-24-8
1968-06-04,ANSWERS TO QUESTIONS UPON NOTICE: Tile Laying Methods (Question No. 232),Mr Scholes,5J4,,https://historichansard.net/hofreps/1968/19680604_reps_26_hor59/#subdebate-31-0
1968-06-04,ANSWERS TO QUESTIONS UPON NOTICE: Tile Laying Methods (Question No. 232),Mr Nixon,009OD,,https://historichansard.net/hofreps/1968/19680604_reps_26_hor59/#subdebate-31-0
1968-06-06,QUESTION: IMMIGRATION,Mr COPE,K5L,The honourable gentleman will be aware that many migrants eligible for naturalisation have not as yet applied to be naturalised.,https://historichansard.net/hofreps/1968/19680606_reps_26_hor59/#subdebate-9-0
1968-06-13,TABLE C: Immigration: National Security (Question No. 233),Mr Calwell,BV8,,https://historichansard.net/hofreps/1968/19680613_reps_26_hor59/#subdebate-46-4
1968-06-13,TABLE C: Immigration (Question No. 341),Mr Snedden,DQF,"Section 12 of the Nationality and Citizenship Act enables British migrants to apply for Australian citizenship by registration, as distinct from naturalisation, which is applicable to non-British migrants.",https://historichansard.net/hofreps/1968/19680613_reps_26_hor59/#subdebate-46-12
1968-08-15,IMMIGRATION PROGRAMME: Ministerial Statement,Mr SNEDDEN,DQF,"after coming here, a person has indicated that he is a fanatical, dedicated follower of some of these authoritarian, dictatorial parties to which I have referred, we can always exercise the right to refuse him naturalisation.",https://historichansard.net/hofreps/1968/19680815_reps_26_hor60/#subdebate-24-0
1968-08-22,CZECHOSLOVAKIA: Ministerial Statement,Mr CONNOR,K0O,"At the scores of naturalisation ceremonies which I have attended I have always been moved to the deepest emotion by the sight of immigrants swearing allegiance to a new land in a new tongue - men and women, poor, honest and sincere, who have come to this land following the greatest Diaspora since Titus.",https://historichansard.net/hofreps/1968/19680822_reps_26_hor60/#subdebate-29-0
1968-09-11,APPROVAL OF WORKS- PUBLIC WORKS COMMITTEE ACT: Attorney-General's Department,Mr HAYDEN,RK4,A tremendous number of people who have sought naturalisation inthis community have had their applications rejected on the basis of security reports.,https://historichansard.net/hofreps/1968/19680911_reps_26_hor60/#subdebate-32-3
1968-09-19,TASMANIA: Aboriginals (Question No. 446),Mr O'Connor,K58,,https://historichansard.net/hofreps/1968/19680919_reps_26_hor60/#subdebate-41-28
1968-09-19,TASMANIA: Aboriginals (Question No. 446),Mr Snedden,DQF,The nationality of these persons immediately prior to naturalisation was as follows:,https://historichansard.net/hofreps/1968/19680919_reps_26_hor60/#subdebate-41-28
1968-09-24,"PERSONAL EXPLANATION: Proposed Expenditure $55,164,000",Mr Charles Jones,KDV,"When a member made representations to former Ministers for Immigration on matters dealing with the rejection of a naturalisation application or of a sponsorship of a migrant, they could not get the exact details of the reasons for a decision, but what was made available to them was information as to whether a nomination, for instance, had been rejected on the grounds of security or the health of the individual concerned.",https://historichansard.net/hofreps/1968/19680924_reps_26_hor60/#subdebate-22-3
1968-09-24,"PERSONAL EXPLANATION: Proposed Expenditure $55,164,000",Mr DALY,6V4,,https://historichansard.net/hofreps/1968/19680924_reps_26_hor60/#subdebate-22-3
1968-09-24,"PERSONAL EXPLANATION: Proposed Expenditure $55,164,000",Mr PETTITT,KY7,,https://historichansard.net/hofreps/1968/19680924_reps_26_hor60/#subdebate-22-3
1968-09-25,ELECTORAL DIVISIONS OF NEW SOUTH WALES: Proposed Redistribution,Mr DEVINE,KCI,Some of these migrants are not naturalised and others do not qualify for naturalisation.,https://historichansard.net/hofreps/1968/19680925_reps_26_hor60/#subdebate-28-0
1968-09-26,ELECTORAL DIVISIONS OF VICTORIA: Proposed Redistribution,Mr BRYANT,JSU,,https://historichansard.net/hofreps/1968/19680926_reps_26_hor60/#subdebate-19-0
1968-09-26,ELECTORAL DIVISIONS OF VICTORIA: Proposed Redistribution,Mr CALWELL,BV8,"No attempt has ever been made to ascertain the number of prospective naturalisations and allowance made for it No attempt has ever been made to assess the destruction of the inner city of Melbourne, and the same applies to the electorate of Melbourne Ports.",https://historichansard.net/hofreps/1968/19680926_reps_26_hor60/#subdebate-19-0
1968-09-26,ELECTORAL DIVISIONS OF SOUTH AUSTRALIA: Proposed Redistribution,Mr WILSON,0K4,"The ceremonies of naturalisation at which new citizens become Australians are, as honourable members well know, conducted by municipal bodies.",https://historichansard.net/hofreps/1968/19680926_reps_26_hor60/#subdebate-28-0
1968-10-08,APPROPRIATION BILL (No. 1) 1968-69,Mr STOKES,KVG,,https://historichansard.net/hofreps/1968/19681008_reps_26_hor60/#debate-24
1968-11-06,QUESTION: NATURALISATION,Mr WILSON,0K4,,https://historichansard.net/hofreps/1968/19681106_reps_26_hor61/#subdebate-12-0
1968-11-06,QUESTION: NATURALISATION,Mr SNEDDEN,DQF,"On the other hand, if mentally retarded persons are under 16 they can become Australian citizens upon the naturalisation of their parents.",https://historichansard.net/hofreps/1968/19681106_reps_26_hor61/#subdebate-12-0
1968-11-12,QUESTION: DUALITY OF CITIZENSHIP,Mr JAMES,KJO,,https://historichansard.net/hofreps/1968/19681112_reps_26_hor61/#subdebate-17-0
1968-11-12,QUESTION: DUALITY OF CITIZENSHIP,Mr SNEDDEN,DQF,The consequence then is that a person who becomes an Australian citizen by naturalisation will have to be careful to ascertain whether he is exclusively an Australian citizen or whether he has duality of citizenship so far as another country is concerned.,https://historichansard.net/hofreps/1968/19681112_reps_26_hor61/#subdebate-17-0
1968-11-12,REVISION OF NATIONALITY AND CITIZENSHIP ACT: Ministerial Statement,Mr SNEDDEN,DQF,"Many migrants from non-British countries, of whom 570.000 have been naturalised since 1945, find difficulty with the fact that naturalisation in Australia results in their becoming not only Australian citizens, as they wish to do, but 'British subjects'.",https://historichansard.net/hofreps/1968/19681112_reps_26_hor61/#subdebate-26-0
1968-11-12,REVISION OF NATIONALITY AND CITIZENSHIP ACT: Children Born to Australian Parents Outside Australia,Mr Clyde Cameron,2V4,"1 said this once at a naturalisation ceremony and a gentleman of the cloth representing the Good Neighbour Council rose in righteous indignation, made a few remarks about the sort of love that these gentlemen preach and had a word or two to say to the effect that I was not fit even to be in the room, much less in the Parliament.",https://historichansard.net/hofreps/1968/19681112_reps_26_hor61/#subdebate-26-2
1968-11-12,REVISION OF NATIONALITY AND CITIZENSHIP ACT: Children Born to Australian Parents Outside Australia,Mr JAMES,KJO,The Government might consider incorporating in the Bill a temporary naturalisation for the reasons mentioned by the honourable member.,https://historichansard.net/hofreps/1968/19681112_reps_26_hor61/#subdebate-26-2
1968-11-12,REVISION OF NATIONALITY AND CITIZENSHIP ACT: Children Born to Australian Parents Outside Australia,Mr Charles Jones,KDV,The Minister should give some consideration to this aspect when he is drafting his Bill and is including provisions to reduce the term before which a person may apply for naturalisation.,https://historichansard.net/hofreps/1968/19681112_reps_26_hor61/#subdebate-26-2
1968-11-12,REVISION OF NATIONALITY AND CITIZENSHIP ACT: Children Born to Australian Parents Outside Australia,Mr UREN,EE4,I have in mind the screening of prospective migrants and naturalisations.,https://historichansard.net/hofreps/1968/19681112_reps_26_hor61/#subdebate-26-2
1968-11-19,COMMONWEALTH REVENUE: Immigration Ministers' Conferences (Question No. 850),Mr Snedden,DQF,The meeting discussed accommodation for migrants with particular reference to the need for low rental housing for migrants; the general need for increased interpreting services in hospitals; the problems associated with the recognition of professional qualifications; all aspects of migrant education and particularly the problems and needs of migrant children which are currently under review by the several State Education Departments and interested Commonwealth Departments; employer recruitment of migrant workers; as well as citizenship and the role of local government in naturalisation ceremonies.,https://historichansard.net/hofreps/1968/19681119_reps_26_hor61/#subdebate-7-14
1968-11-21,ADULTHOOD BILL 1968: Second Reading,Mr WHITLAM,6U4,,https://historichansard.net/hofreps/1968/19681121_reps_26_hor61/#subdebate-30-0
1969-02-25,AUSTRALIAN COUNCIL FOR THE ARTS: GRANTS FOR 1968-69: Naturalisation (Question No. 1054),Mr Charles Jones,KDV,"How many applications for naturalisation have been rejected annually since 1st January and what were the reasons for rejection grouped under headings such as security, education, etc?",https://historichansard.net/hofreps/1969/19690225_reps_26_hor62/#subdebate-36-4
1969-03-06,QUESTION: IMMIGRATION,Mr COPE,K5L,Can the Minister for Immigration indicate when the Government intends to reduce to 3 years the 5-year residential qualification period for naturalisation purposes?,https://historichansard.net/hofreps/1969/19690306_reps_26_hor62/#subdebate-8-0
1969-03-18,RESIGNATION OF MR G. C. HOFFMANN: Discussion of Matter of Public Importance,Mr WHITLAM,6U4,,https://historichansard.net/hofreps/1969/19690318_reps_26_hor62/#subdebate-23-0
1969-03-18,RESIGNATION OF MR G. C. HOFFMANN: Also:,Mr BRYANT,JSU,"In the last 15 or 16 years 500 people, two or three of whom I know personally, have been refused naturalisation - one or two of them being quite as loyal and as decent Australians as anybody in this House.",https://historichansard.net/hofreps/1969/19690318_reps_26_hor62/#subdebate-23-1
1969-03-26,ANSWERS TO QUESTIONS UPON NOTICE: Administrative Appeals Committee: Migrants (Question No. 1251),Mr Whitlam,6U4,Is  Mr Justice  Kerr's administrative appeals committee empowered to recommend appeals to the proposed Commonwealth Superior Court by migrants (a) whose applications for naturalisation are deferred or rejected on security grounds or (b) who have been notified of the grounds upon which it is proposed to deport them?,https://historichansard.net/hofreps/1969/19690326_reps_26_hor62/#subdebate-29-6
1969-04-15,HEALTH INSURANCE: Ministerial Statement,Mr McIVOR,KRK,"It should be remembered that Commonwealth rehabilitation aid provided by the Department of Social Services is available only to a proportion of the community, such as invalid pensioners, migrants on sickness benefits who have not been resident long enough to qualify for naturalisation, and people of limited means specifically recommended by their medical practitioners.",https://historichansard.net/hofreps/1969/19690415_reps_26_hor62/#subdebate-33-0
1969-04-17,CITIZENSHIP BILL 1969: Second Reading,Mr SNEDDEN,DQF,The purpose of clause 21 of the Bill is to implement the Government decision that the term 'certificate of Australian citizenship' should in future be used to replace the present designations 'certificate of registration as an Australian citizen' and 'certificate of naturalisation of an Australian citizen'.,https://historichansard.net/hofreps/1969/19690417_reps_26_hor62/#subdebate-23-0
1969-05-01,CITIZENSHIP BILL 1969: Second Reading,Mr Clyde Cameron,2V4,"I have the names of other people who have committed criminal offences after 3 years and before the end of 5 years residence in Australia who, if they were able to qualify for naturalisation within the accelerated period, could have got it but they could not have been deported thereafter for the offences they had committed.",https://historichansard.net/hofreps/1969/19690501_reps_26_hor63/#subdebate-29-0
1969-05-01,CITIZENSHIP BILL 1969: Second Reading,Mr WILSON,0K4,"These grounds include birth, descent, registration, naturalisation and incorporation of territory.",https://historichansard.net/hofreps/1969/19690501_reps_26_hor63/#subdebate-29-0
1969-05-01,CITIZENSHIP BILL 1969: Second Reading,Mr CALWELL,BV8,I think that our gift of naturalisation is so great and so valuable that it should not be lightly regarded.,https://historichansard.net/hofreps/1969/19690501_reps_26_hor63/#subdebate-29-0
1969-05-01,CITIZENSHIP BILL 1969: Second Reading,Mr McLEAY,KSB,I agree with the right honourable member for Melbourne that naturalisation and citizenship are things we should prize.,https://historichansard.net/hofreps/1969/19690501_reps_26_hor63/#subdebate-29-0
1969-05-01,CITIZENSHIP BILL 1969: Second Reading,Mr COLLARD,JZX,"Amendments are proposed also to section 12, which relates to citizenship by registration, and to section IS, which relates to citizenship by naturalisation.",https://historichansard.net/hofreps/1969/19690501_reps_26_hor63/#subdebate-29-0
1969-05-01,CITIZENSHIP BILL 1969: Second Reading,Mr DOBIE,3G4,I am strongly opposed to forcing naturalisation and I was pleased to note when the Public Accounts Committee was investigating the Department that this was the official viewpoint also.,https://historichansard.net/hofreps/1969/19690501_reps_26_hor63/#subdebate-29-0
1969-05-01,CITIZENSHIP BILL 1969: Second Reading,Mr DALY,6V4,The honourable member for Hughes  (Mr Dobie)  touched on the provision that a person seeking naturalisation must be prepared to renounce allegiance to the country of his origin.,https://historichansard.net/hofreps/1969/19690501_reps_26_hor63/#subdebate-29-0
1969-05-01,CITIZENSHIP BILL 1969: Second Reading,Mr Donald Cameron,9F4,"1 am particularly pleased with the humane proposal in this Bill that migrants over the age of 60 years who have not been able to learn English may obtain citizenship or, as it is more usually called, naturalisation.",https://historichansard.net/hofreps/1969/19690501_reps_26_hor63/#subdebate-29-0
1969-05-01,CITIZENSHIP BILL 1969: Second Reading,Mr CONNOR,K0O,In the interviews I have with the various migrants who come to me for assistance I invariably ask them how long they have lived in Australia and what their attitude is towards naturalisation.,https://historichansard.net/hofreps/1969/19690501_reps_26_hor63/#subdebate-29-0
1969-05-13,CITIZENSHIP BILL1969: Second Reading,Mr SNEDDEN,DQF,The honourable member for Grayndler  (Mr Daly)  asked whether the Government would consider reducing the qualifying period for all persons seeking naturalisation as under this Bill it had been reduced in certain cases.,https://historichansard.net/hofreps/1969/19690513_reps_26_hor63/#subdebate-18-0
1969-05-15,"ADJOURNMENT: Friday, 16 May 1969",Mr JAMES,KJO,,https://historichansard.net/hofreps/1969/19690515_reps_26_hor63/#subdebate-48-1
1969-05-27,ANSWERS TO QUESTIONS UPON NOTICE: Naturalisation of Asians (Question No. 1418),Mr Duthie,KDA,,https://historichansard.net/hofreps/1969/19690527_reps_26_hor63/#subdebate-22-6
1969-05-27,ANSWERS TO QUESTIONS UPON NOTICE: Naturalisation of Asians (Question No. 1418),Mr Snedden,DQF,The following table shows the numbers of Asians who have been granted Australian citizenship by naturalisation between 1st July 1956 and 31st December 1968:,https://historichansard.net/hofreps/1969/19690527_reps_26_hor63/#subdebate-22-6
1969-08-19,IMMIGRATION: Ministerial Statement,Mr Clyde Cameron,2V4,,https://historichansard.net/hofreps/1969/19690819_reps_26_hor64/#subdebate-18-0
1969-08-28,ANSWERS TO QUESTIONS UPON NOTICE: Migration Act (Question No. 1598),Mr Hayden,RK4,Will he consider taking steps to amend the Migration Act so that any refusal by him of an entry permit or application for naturalisation would be accompanied by an explanation of such refusal which would be challengeable in the courts.,https://historichansard.net/hofreps/1969/19690828_reps_26_hor64/#subdebate-34-1
1969-09-09,BILLS RETURNED FROM THE SENATE,Mr DALY,6V4,"I think it might welt be surprised by the impetus this would give to the naturalisation of immigrants, particularly those who find the language barrier a problem.",https://historichansard.net/hofreps/1969/19690909_reps_26_hor65/#debate-32
1969-09-09,BILLS RETURNED FROM THE SENATE,Mr PETTITT,KY7,,https://historichansard.net/hofreps/1969/19690909_reps_26_hor65/#debate-32
1969-09-09,BILLS RETURNED FROM THE SENATE,Mr Clyde Cameron,2V4,"If the people now being denied naturalisation are so bad that they should not be naturalised, they should never have been brought here in the first place and there is something wrong with our screening activities if this is so.",https://historichansard.net/hofreps/1969/19690909_reps_26_hor65/#debate-32
1969-09-09,BILLS RETURNED FROM THE SENATE,Mr SNEDDEN,DQF,"Of the 521 migrants who were refused naturalisation, 116 were subsequently given naturalisation.",https://historichansard.net/hofreps/1969/19690909_reps_26_hor65/#debate-32
1969-09-09,BILLS RETURNED FROM THE SENATE,Mr BRYANT,JSU,So as far as this concerns naturalisation it has become a political matter.,https://historichansard.net/hofreps/1969/19690909_reps_26_hor65/#debate-32
1969-09-09,NET FLOWS OF OFFICIAL AND PRIVATE RESOURCES TO DEVELOPING COUNTRIES IN 1968: Naturalisations (Question No. 1881),Mr Whitlam,6U4,naturalisation were conferred in the last two years in each local government area in which more than 100 certificates were conferred?,https://historichansard.net/hofreps/1969/19690909_reps_26_hor65/#subdebate-35-3
1969-09-18,ANSWERS TO QUESTIONS UPON NOTICE: Naturalisations (Question No. 1917),Mr Clyde Cameron,2V4,What percentage of migrants who have been refused naturalisation were rejected on grounds of security based on the political persuasions of the applicant.,https://historichansard.net/hofreps/1969/19690918_reps_26_hor65/#subdebate-34-2
